Comment,Author,Score,Upvotes,Downvotes
I'd go with David McWiĺiams' answer. A factory in the midlands churning out prefabricated houses. Funded by the state.,shevek65,64,64,0
Add scallions to your mash.,90000001127,27,27,0
"The first and easiest thing to do would be to increase apprentice salaries so they at least make minimum wage. 

Yes, it would have a marginal increase in construction costs but it would help bring more capacity to the sector.",KillerKlown88,69,69,0
"I've filled out the form. What I would do is;

1. Vacant Land Tax
2. Expand Critical Skills Visa to include trades to entice more tradespeople to work in the country.
3. Concentrate on Low Rise (5-7 Story) Appartment building in city centre locations. This will reduce the sprall of building outward and maintain the existing natural state of Irelands Green Fields. This will also free up Houses currently being shared by individuals who will likely be more enticed by appartment living.
4. Restrict the ability to object to Planning Permission. 
5. The greater Need for Housing should override individual concerns for Planning Ojections and Decision by An Board Planala.

I honestly feel that while this won't do anyone any good in the short to medium term. This is the best long-term strategy",IronicallyBad90,28,28,0
"(from the site)  


This consultation is being carried on behalf of the Housing Commission. The purpose of the consultation is to inform the Housing Commission’s consideration of long-term housing policy post 2030. It is also looking at current housing issues that could affect the long-term.

The Commission is seeking specific views on each of the following areas:

* maintaining a long-term sustainable housing supply and providing balance and choice of tenures
* the cost and quality of housing, including the drivers of cost
* the capacity of the construction sector to meet housing supply requirements
* the affordability of private rental accommodation
* the affordability of house purchasing for first-time buyers
* rural housing
* regulation of social housing
* the role of Approved Housing Bodies in housing provision",bigvalen,8,8,0
"Government overriding planning rejections based on esthetics and scale 

800 homes refused planning yesterday because it's too big and not esthetically pleasing? You know what's not esthetically pleasing, tents on our streets.",irish_guy,21,21,0
"I will probably be downvoted to hell, but maybe if the entire Irish government at all levels weren't landlords, the problem would be solved in time.   
Upton Sinclair said "" **It is difficult to get a man to understand something when his salary depends on his not understanding it.""**  


The housing crisis is complex, true. But the Landlords in the Irish government have been at it a while. Undoing it is possible, but not when every single government office is held by a landlord.  


Just my 2 pennies from observation as I wait on my landlord to decide if she is going to rent to me for another year or turn me and my family out to be homeless while she tells the state that she is moving her kid in and rents this place for 1k more a month...",paracrime,23,23,0
"Planned expansion of our cities, and possible new cities, with medium rise apartments and public amenities. Like most European countries did in the 1920s and 1960s, when there was massive waves of urbanisation - or throughout the 19th century in the UK and US. We need greater Dublin city to look more like Barcelona with blocks of apartments and scattered parks and metros. The city centre can stay the same but start a big plan to turn the suburbs into blocks of medium rise. Build a new high rise neighbourhood to for a new CBD. Link them all with a metro.  Build enough and they'll be full of middle class people, and be active with street level commercial shops and business and help build a 15 minute city.

Limerick or Sligo and somewhere in the Midlands could become new medium cities too. Build the accommodation, businesses and transportation and take the pressure off Dublin.",Saoi_,6,6,0
"Taiwan fits 23 million people on an island of roughly the same size, and has 75% forest coverage.

Not saying the islands are directly comparable,

But there has to be SOMETHING we can learn from that.",Acegonia,5,5,0
"Cut VAT on all new builds. Make all long term ,(not AirBnB) rental income subject to the lower rate of income tax, streamline the planning process, increase property tax by 500% on vacant properties and allow high rise developments in central business districts of city centres ,(Dublin, Galway, Cork, Limerick, Waterford). Use the Vancouver model for urban development i.e. footprint of apartment block = footprint of green space beside apartment block,(I buy 2 acres. I get to develop 1acre on the condition I use the other 1acre as a public park).",Dangerous-Shirt-7384,4,4,0
Hunger games,pedroelkillio1984,8,8,0
"Stop this ridiculous law that allows landlords to put up rent every year.  It might be a small amount, but my wages don't go up to match it.

Have a government run company where landlords can sign up to and renters can easily get access to.  It seems to only daft in Ireland who have neithers best interest as a priority.",pizza_goes_splat,7,7,0
Total revamp of the planning process.,MeinhofBaader,6,6,0
"I got put in the naughty corner for jokingly suggesting genocide as a possible solution previously.

In truth though we need more accommodation or less people looking for it so incentives for people to emigrate combined with mass building projects maintained by governments and rented out en masse affordably.

Short term perhaps get people renting council houses with extra bedrooms take in people about to be made homeless with these evictions looming.",SteveK27982,3,3,0
Don't vote FG/FF,FlamingBaconCake,15,15,0
Build more.,dashoonage,6,6,0
I had a good auld rant there. Cheers OP.,GorthTheBabeMagnet,2,2,0
"1. Change to a more consistent zonal planning system
2. Make planning about appropriate building structure and not who is building (no local needs)
3. Include alternative building methods in the approved builders group that builders have to be in so you can get modular builds insured when applying for a mortgage
4. Make the definition of an affordable house the central bank mortgage lending limit (3.5x) multiplied by the 33rd percentile national income plus 10% (for the required deposit).
5. Planning permission only granted for multi unit developments if they have at least one third of each class (2 bed, 3 bed, 4 bed) for sale at affordable prices to means tested buyers ... OR govt/councils engage builders directly to provide affordable housing per definition 
6. No more large estates full of cul de sacs. Planning permission only if estates allow passthrough traffic on streets (not stroads), and provide public transport links into and through the estates. This will hopefully make estates out of the city more appealing with easier commutes and greater walkability 
7. Quality mid rise flats in the inner cities with mixed affordability options in a single block
8. Incentivize commerce and light industry in towns outside of Dublin and housing isn't as expensive to build",sirlarkstolemy_u,2,2,0
"I don't have any single answer but I've got a few suggestions.

Firstly I would come up with some kind of local demand test which would determine if there were people looking to buy properties in which they will actually live in within a given area and where the supply was not meeting demand. If that was the case then  a quota would be set for the number of properties that can be bought in that areas for investment purposes.

I'd also overhaul the planning system to make it easier to build high density housing. I'd reduce the amount of weight given to objections when decisions are made and also require them to prove (at their expense) any negative effects they claim they will suffer if the application was granted.

I'd establish easy planning zones away from the sticks but close to motorways and railway lines. These would be areas where planning applications could only be turned down if it was showen that the designs were bad or unsafe. So basically a developer could say I want to build 50 houses here and so long as the design of the houses was ok and and things like rods and utilities were taken care of then the application would be waved through.

I'd also seek to introduce a constitutional change requiring TDs to be only TDs. You would have to give up any business interests you have before you could take your seat. It doesn't matter how many good ideas there are to fix the housing crisis, nothing will change when a huge chunk of our TDs are looking after their own financial interests.",TheSameButBetter,2,2,0
"Reading through that public consultation was wild.  
It's like they want any possible solution EXCEPT for them to actually build more housing.",GorthTheBabeMagnet,3,3,0
*Significantly* increase taxes after first property. Stop vulture funds and landlords from monopolising property. I’m not against investment vehicle but don’t think people should be homeless as a result of them.,irishnugget,2,2,0
"Build more apartments

Start stripping pensions from ministers that aren't achieving actual progress on getting build completions through 

Implement something drastic like 1 in when 1 goes out for non eu immigration (controversial I know but the bath tub is at max capacity)",insomnium2020,2,2,0
"I’m with the guy who wanted to turn asylum seekers into slaves here a while back.

Maybe children too, asylum seeking children for extra bonus production",forfudgecake,1,1,0
"end all rental welfare payments in the private market, it clearly pushes up rents for average renters. It makes a mockery of work for young people and the normal waged.",silverharpDublin,1,1,0
"Ireland should start to build more houses and enact a law that stops people from shutting down new projects due to NIMBY bullshit. We literally just need to keep building them and remove the barriers from doing so. 

You could also jack up the tax rate for anyone who owns a house that isn't a primary residence, making it less lucrative to use housing as an investment engine.",SpyderDM,0,0,0
get the people off the dole and make them work and it will resolve very quickly....,thuia,0,0,0
[removed],,-4,-4,0
Bitcoin would solve a lot of the problems with the housing crisis.,Shenzen_Daub,-5,-5,0
Make everyone with a spare bedroom take in a person who needs accommodation.,Busy_Moment_7380,-7,-7,0
Govt kicks in a U.S. style CCC corps program and re educates people how to build simple one family homes…go traditional even out of cob or natural materials…stone.,RazMani,1,1,0
State bank set-up or just use the old Allied Irish to fund small-mid-large construction projects. Use this bank to audit/regulate EU inward investment on all infrastructure projects.,sithnaround,1,1,0
"Some governments have a fair housing act in place. This enforces all towns, cities and municipalities to maintain a designated percentage of all equal available dwellings at a price below market to allow for lower income families to dwell in said places. 

Lets use 30% as the benchmark For instance, if a developer knocks down a block of row houses and then builds a ten story 200 unit building, 60 of those would have to be rented at a price to allow for those lower on the income scale.

This could also be structured for redevelopment, newly developed neighborhoods, and existing residential rental space.",DoubleFeedback2672,1,1,0
"Submitted the form, telling them to make tiny homes a priority to help solve the issue quickly",Sandmansam3rd,1,1,0
"1: ABP has collapsed, setup a planning *authority* that supersedes high courts.

2: VAT removed from all housing construction costs 

3: Relax mortgages for singles to purchase 1 bed apartments",lustyforJusty,1,1,0
build,bigmickeyblue,1,1,0
"REIC's expected profits are not compatible with the national interest right now. There needs to be a pause on REIC's investments, to be replaced directly with a central government agency that would invest and build houses/apartments, with the debt paid off over the lifetime of the properties. The government would make a nice profit too. They could wind down the construction part of this agency after 5-10 years so as to attract REIC's back into the market, albeit at a much more reasonable percentage of the market than today.",miscreant-mouse,1,1,0
"A solution?! No no no, I only object!!",Dependent_Survey_546,1,1,0
"Construction is one of the most heavily taxed economic activities in Ireland, between VAT on new residential properties, development levies, and all the other taxes that every business has to pay. It’s basic economics that if you tax something heavily less of it will be produced, and it’s a fact that even if land was sourced at its agricultural value the high cost of construction in Ireland plus taxes would still put purchase of new homes beyond the economic reach of a large share of the population. My opinion is that we should abolish VAT on residential construction, cut back hard on development levies, and use the taxation system aggressively to crash the price of land suitable for residential construction.",MarramTime,1,1,0
"Once the immediate emergency is over we need to redesign the entire system around housing. 

Part of this could be a social credit system where there's a tangible value placed on your contribution to society. For example nurses, teachers, postmen, carer's all contribute real value to society. We can't get by without them but yet they often can't afford to buy a house in the community they work in. 

A social credit system placing monitory value against a mortgage would be a potential way to level up communities and help low income workers get a fair shake.",Maradona-1990,1,1,0
Homeless charities could merge and use their combined financial resources to buy land and build homes. There should be a single homeless charity with non paid volunteers working together to help fix the problem and the government should match everything they do.,xlogo65,1,1,0
"Commie blocks. Lots of them. And if you're a landlord, you get the choice of remaining one and living in a commie block, or selling up all but the property you're living in.",RAKtheUndead,1,1,0
"New law: Leo isnt allowed to speak in public until the crisis is solved. No quips, barbs, or snide comments may be uttered anywhere where an rte microphone could pick it up or a constituent might hear. 

Trust me, we would see an apartment building rush that will be the stuff of legends",cmdrillicitmajor,2,2,0
"1: extend the eviction ban for three years.
2: derelict/ vacant site & building tax running at 15-20% of market value & insert a sell,use or lose clause after a given period.
3: start a state owned building company . 
4: use state owned NAMA land to start building on .
5: institute a buy back scheme form REIT owned properties at cost price.
6: stream line the planning process.",dearg_doom80,1,1,0
Build a new capital megacity comparable with what those nutters in Saudi Arabia are up to. Hundreds of thousands of homes and high rise space. Both the north and south will work together on it as part of a United Ireland. The UK and the EU will pay for the whole thing.,alright_rocko,1,1,0
"Government buys empty and poorly maintained place, refurnish and sell them to People! Not cuckoo funds ! Normal people being landlords will benefit the district by living and spending money!. Business will have more people that can afford to live and not just spend shit tons of money in rent",Pickle-Pierre,1,1,0
https://www.belgradewaterfront.com/en/ 2 developments of this scale and we’re half way there.,free_t,1,1,0
Dublin II,momalloyd,1,1,0
Take up travelling.,VilvisMargots,1,1,0
Compulsory purchase a whole bunch of rental properties and put them in a scheme for first time buyers.,MoneyBadgerEx,1,1,0
Fuck off with that bullshit. If your plan is the general public 9 years late you are fucked. The bottle necks should be very clear at stage.,FitPast1362,1,1,0
"I am a bit late to the party here and this will probably be buried in the responses but I have a bit of a different take to most.

Make buying property less of an attractive investing option.

At the moment investing options in Ireland are limited. EFTs charge over 50% on earnings and DIRT is higher compared to most countries. When you’ve already maxed out your pension the only real legitimate investing option left is property. It’s a low risk with a relative guarantee of a decent ROI. 

I think if you open up other investment options such as reducing the tax on EFTs while simultaneously increasing the tax on rental properties / vacant properties it would shift the market focus and more landlords would leave the market freeing up accommodation for purchase / rent. 

Source - I am looking to invest and after doing my research property is the only thing that makes sense",Bubbleking87,1,1,0
"There are a lot of insightful suggestions in the comments here, I hope commenters are submitting these in the questionnaire.",MsTrivia,1,1,0
"I think that is an actual answer to the problem. If it increases supply, brings down the price of rent and can be done quickly it is certainly something that should be done.",RelaxedConvivial,17,17,0
"The answer to this is two fold:

1. Over 40% of new houses built are modular - Offsite Tek, Monaghan, is one of largest and most advanced modular companies in the world!

2. Cost: a fully-fledged, state of the art modular home factory, working 24/7 every day, can produce about 2,500-3,000 homes a year. So we’d need 20 of them. And they cost literally billions to build.",Trabolgan,2,2,0
"One for everybody's back garden, so there can be no complaining.",momalloyd,1,1,0
Prefabricated Units are faster to construct and they cost less. They can solve the issue in seriously squeezed categories like single people for example needing their own place or students.,Infinaris,1,1,0
We definitely need to do more to encourage young people to work in the trades. The state invested tens of thousands in my third level education and I'm not nearly as vital to the country as a builder or electrician.,Kyadagum_Dulgadee,28,28,0
"I have applied for (after today) 14 apprenticeships this year without a reply. 
Countless over the years. I do not personally care about the pay although it would be nice. I think government-led schemes should be taught all across the country.",ixlHD,3,3,0
Did you just suggest something that would raise house prices?,Glenster118,2,2,0
"  No incentives for employers to take on apprentices if they have no skills, as it stands now I find the system around apprenticeships absolutely dire. 
 One day a week in college as apposed to what we have at the moment. 

 Apprentices are not worth the hassle as is stands now.",budlystuff,0,0,0
"Seems like an excellent idea. 

The other thing to try and fix would be the job security. We had a lot of out of work builders from 2008 onwards, who either had to retire early, go on the dole or emigrate.",Takseen,1,1,0
"Offset it with tax. I am sale agreed on a house and would be on the ladder before it had an impact, but I'd happily pay a bit more to get this sorted. We're at the point that it's a hair away from becoming *extremely* societally damaging.",BenderRodriguez14,1,1,0
"I'd agree here with the one change that I woukd say to go for 10-15 stories in the city centre and 5-7 stories for a few km outside it (Rathmines, Ranelagh, Drimnagh, Drumcondra, East Wall type areas). Eith the slow, slow speed of construction here and the fact Dublin is likely to keep on growing for quite some time, it's best to future proof this in my opinion.",BenderRodriguez14,6,6,0
Vacant land tax? Goodbye what little nature we have left.,AnDagdadubh,2,2,0
Your last point is huge. So many projects get binned because of petty objections that are completely unreasonable yet somehow get upheld.,epicness_personified,0,0,0
That's OK they'll just run those tents down in JCBs or send in the riot squad to demand the occupants stop being so visibly homeless.,BenderRodriguez14,1,1,0
It's not just the landlords in the government. 70% of people here own their home. It's not in the interest of the biggest chunk of the population to have real estate value go down,Ev17_64mer,6,6,0
If only there were some blatantly obvious answer [right in front of our eyes.](https://upload.wikimedia.org/wikipedia/commons/b/b9/20200809_Taipei%2C_Taiwan_Skyline.jpg),BenderRodriguez14,3,3,0
I'd agree if any of the opposition were pushing for the ideas being put forward in this thread.,RunParking3333,9,9,0
But how,somasogoods,1,1,0
"So you want to fix the housing crisis by causing a homelessness crisis? I mean that's in line with that the govt is doing now so you're onto something.

Or, the government starts to increase the supply of homes, lowers rents, and then eases off rental welfare payments. Lowers the burden without makings tens of thousands homeless.",Lezflano,4,4,0
"Your second point would reduce rental supply, no?",somasogoods,5,5,0
[deleted],,1,1,0
"This comment has been removed by automod, on behalf of the community, pending review by a moderator.


*I am a bot, and this action was performed automatically. Please [contact the moderators of this subreddit](/message/compose/?to=/r/ireland) if you have any questions or concerns.*",AutoModerator,1,1,0
"Yeah he gave an example of German prefabricated homes. We're way behind in construction technology, we could be printing concrete homes basically. Also theres a stigma around timber framed houses.  

Would take a lot of investment but apparently the country is awash with corporate tax receipts so drive on.",shevek65,16,16,0
"Where are you getting the 40% figure from? Seems quite high.

And also the cost of building the factories, how do you know its prohibitive?",shevek65,1,1,0
"I have a nephew wo is in 6th year, he has no interest in college and would love a trade but he won't leave his retail job because he earns €11.50 an hour and has been told he can go full time in July.

How many other teenagers are in the same situation.",KillerKlown88,19,19,0
Over time it would likely reduce them if we can scale up construction.,KillerKlown88,1,1,0
"The whole point of apprenticeships is to develop skills.

If employers want skilled people then they shouldn't be looking at apprentice.",KillerKlown88,1,1,0
"Job security is a massive issues too. 

The amount of people who have been told on a Friday that they have no work next week is crazy.",KillerKlown88,1,1,0
Same way as we build the rest.,dashoonage,-1,-1,0
"its part of the reason for the current mess, there is little reason for the gov to build gov housing if it can just buy up private properties and rental properties. Ive not given it a thought to how you would unwind it.

You do acknowledge the inherent unfairness that young people who work and other workers are competing with the government for the same properties?",silverharpDublin,2,2,0
They wouldn’t be homeless. They’d just need to flat share like all young people who pay the taxes to fund their single occupancy homes….,bayman81,1,1,0
"It would also allow current renters who want to buy to get their forever home, reducing demand for rent.

Existing houses being used as rental properties benefits nobody.

We don't need rentiers to finance developments while we have such pent up demand for house purchases.",Backrow6,0,0,0
They are in social houses,Reasonable-Arugula87,1,1,0
"https://www.youtube.com/watch?v=Y-4S7cdo3tY

Youtube video looking at recent 3d printed concrete houses in the usa.

I'm a fan of McWilliams thinking. How is the state not doing this, or the modular home built in a factory?",johnebastille,8,8,0
">We're way behind in construction technology

I'm living on the continent and currently renovating a house. My dad is a fairly accomplished project manager in Ireland. He came over to help me out and the local builders found his methods and practices laughably out of date. I ended up having to redo a lot of his work which was very awkward",Little_Matty_Mara,2,2,0
"Got it from Gerry McCaughey - his dad was the original Timberframe guy! He’s the founder of the company I mentioned above. 

It’s because to make that many homes, that means as much rapid automation as possible, which means lots of robots, people smart enough (and qualified enough) to build and configure the robots for each project, energy usage, etc etc. Plus it takes a couple of years to build one. Then there’s the current high price of building materials, land, labour etc. 

I could say automated machines but robots sounds cooler. I like to imagine 300 Benders building a house for me. 

Don’t get me wrong, modular is the future - it’s just not the present. It will have to be the future if we’re ever going to make housebuilding efficient enough that our workforce can ever actually make enough for everybody. 

Another problem is the huge resistance amongst regular builders to use it. 

I could write for *hours* on the background to the housing crisis (it’s partly political, yes, but there are huge underlying demographic trends that are mostly responsible), modular housing, the current Govt schemes etc.",Trabolgan,2,2,0
Long term wouldn't he be way better off? By the time he's in his mid twenties and even more trades retire he could name his price,leeroyer,18,18,0
"And if he went to college he would be getting zero euro wages per week.  

He would be better off getting good advice, thinking a bit more long term beyond one or two years.",53Degrees,1,1,0
Your nephew sounds short-sighted but luckily not a commentary on others in that position,tollhotblond3,-4,-4,0
Sounds like he's not the brightest fella,EFbVSwN5ksT6qj,0,0,0
That gave me a chuckle,ShoulderNew4741,1,1,0
